Title,Url,Rating,Subject,Global_URL
Understanding IELTS: Reading,https://www.classcentral.com/course/understanding-ielts-reading-17038,4.8813559322034,Education & Teaching Courses,https://www.classcentral.com/subject/education?page=1
Understanding IELTS: Speaking,https://www.classcentral.com/course/understanding-ielts-speaking-17037,4.8888888888889,Education & Teaching Courses,https://www.classcentral.com/subject/education?page=1
The IB Extended Essay: Managing your Research Project,https://www.classcentral.com/course/ib-extended-essay-12702,4.6511627906977,Education & Teaching Courses,https://www.classcentral.com/subject/education?page=1
Migrants and Refugees in Education: A toolkit for teachers,https://www.classcentral.com/course/migrants-and-refugees-in-education-11825,4.8076923076923,Education & Teaching Courses,https://www.classcentral.com/subject/education?page=1
"Education for All: Disability, Diversity and Inclusion ",https://www.classcentral.com/course/education-for-all-5664,4.7380952380952,Education & Teaching Courses,https://www.classcentral.com/subject/education?page=1
Modelli di insegnamento nella ricerca educativa,https://www.classcentral.com/course/edx-modelli-di-insegnamento-nella-ricerca-educativa-11405,5,Education & Teaching Courses,https://www.classcentral.com/subject/education?page=1
Aprendizaje y Enseñanza Virtual,https://www.classcentral.com/course/edx-aprendizaje-y-ensenanza-virtual-7266,4.2941176470588,Education & Teaching Courses,https://www.classcentral.com/subject/education?page=1
Learning Online: Researching Your Project,https://www.classcentral.com/course/searching-and-researching-5019,4,Education & Teaching Courses,https://www.classcentral.com/subject/education?page=1
Teaching Character and Creating Positive Classrooms ,https://www.classcentral.com/course/teaching-character-866,4.5,Education & Teaching Courses,https://www.classcentral.com/subject/education?page=1
Leaders of Learning,https://www.classcentral.com/course/edx-leaders-of-learning-2027,4.4,Education & Teaching Courses,https://www.classcentral.com/subject/education?page=1
Applying to U.S. Universities,https://www.classcentral.com/course/usuniversities-1620,3.8,Education & Teaching Courses,https://www.classcentral.com/subject/education?page=1
"American Education Reform: History, Policy, Practice",https://www.classcentral.com/course/edref-2793,4.5555555555556,Education & Teaching Courses,https://www.classcentral.com/subject/education?page=1
Learning Online: Communicating and Collaborating,https://www.classcentral.com/course/learning-and-collaborating-5015,4.1111111111111,Education & Teaching Courses,https://www.classcentral.com/subject/education?page=1
Introducción a las tecnologías para la Educación,https://www.classcentral.com/course/edx-introduccion-a-las-tecnologias-para-la-educacion-2956,4.5,Education & Teaching Courses,https://www.classcentral.com/subject/education?page=1
IT Fundamentals for Business Professionals: Enterprise Systems,https://www.classcentral.com/course/edx-it-fundamentals-for-business-professionals-enterprise-systems-3787,4.1666666666667,Education & Teaching Courses,https://www.classcentral.com/subject/education?page=1
IT Fundamentals for Business Professionals: Software development,https://www.classcentral.com/course/edx-it-fundamentals-for-business-professionals-software-development-3788,4.9,Education & Teaching Courses,https://www.classcentral.com/subject/education?page=1
Fundamentos TIC para profesionales de negocios: Programación,https://www.classcentral.com/course/edx-fundamentos-tic-para-profesionales-de-negocios-programacion-9131,4.7,Education & Teaching Courses,https://www.classcentral.com/subject/education?page=1
IT Fundamentals for Business Professionals: Programming,https://www.classcentral.com/course/edx-it-fundamentals-for-business-professionals-programming-3785,4.7777777777778,Education & Teaching Courses,https://www.classcentral.com/subject/education?page=1
Academic Information Seeking,https://www.classcentral.com/course/academicinfoseek-5153,4.4285714285714,Education & Teaching Courses,https://www.classcentral.com/subject/education?page=1
K-12 Blended & Online Learning,https://www.classcentral.com/course/k-12-online-education-1531,0,Education & Teaching Courses,https://www.classcentral.com/subject/education?page=1
Foundations of Teaching for Learning: Introduction,https://www.classcentral.com/course/teaching-874,2,Education & Teaching Courses,https://www.classcentral.com/subject/education?page=1
Foundations of Teaching for Learning: Being a Teacher,https://www.classcentral.com/course/being-a-teacher-875,0,Education & Teaching Courses,https://www.classcentral.com/subject/education?page=1
Foundations of Teaching for Learning: Learners and Learning,https://www.classcentral.com/course/teaching-learning-876,4.75,Education & Teaching Courses,https://www.classcentral.com/subject/education?page=1
Foundations of Teaching for Learning: Curriculum,https://www.classcentral.com/course/teacher-curriculum-877,0,Education & Teaching Courses,https://www.classcentral.com/subject/education?page=1
Foundations of Teaching for Learning: Planning for Teaching and Learning,https://www.classcentral.com/course/teaching-plan-882,2.5,Education & Teaching Courses,https://www.classcentral.com/subject/education?page=1
Foundations of Teaching for Learning: Introduction to Student Assessment,https://www.classcentral.com/course/learning-assessment-883,4,Education & Teaching Courses,https://www.classcentral.com/subject/education?page=1
The Place of Music in 21st Century Education,https://www.classcentral.com/course/music-education-5950,0,Education & Teaching Courses,https://www.classcentral.com/subject/education?page=1
El desafío de Innovar en la Educación Superior,https://www.classcentral.com/course/educacion-superior-5911,5,Education & Teaching Courses,https://www.classcentral.com/subject/education?page=1
Aprenda a ensinar programação com o Programaê!,https://www.classcentral.com/course/programae-4470,0,Education & Teaching Courses,https://www.classcentral.com/subject/education?page=1
Fundamentos do Google para o Ensino,https://www.classcentral.com/course/fundamentosgoogle-4476,0,Education & Teaching Courses,https://www.classcentral.com/subject/education?page=1
Explorando os recursos educacionais da Khan Academy,https://www.classcentral.com/course/khanacademy-4479,0,Education & Teaching Courses,https://www.classcentral.com/subject/education?page=1
Ensino Híbrido: Personalização e Tecnologia na Educação,https://www.classcentral.com/course/ensino-hibrido-4435,0,Education & Teaching Courses,https://www.classcentral.com/subject/education?page=1
Instructional Methods in Health Professions Education,https://www.classcentral.com/course/instructmethodshpe-949,4.5,Education & Teaching Courses,https://www.classcentral.com/subject/education?page=1
Compassionate Leadership Through Service Learning with Jane Goodall and Roots & Shoots,https://www.classcentral.com/course/compassionate-leadership-jane-goodall-2101,0,Education & Teaching Courses,https://www.classcentral.com/subject/education?page=1
Get Organized: How to be a Together Teacher,https://www.classcentral.com/course/togetherteacher-2113,4.3333333333333,Education & Teaching Courses,https://www.classcentral.com/subject/education?page=1
Powerful Tools for Teaching and Learning: Web 2.0 Tools,https://www.classcentral.com/course/newtechtools-3140,4,Education & Teaching Courses,https://www.classcentral.com/subject/education?page=1
Foundations of Virtual Instruction ,https://www.classcentral.com/course/virtual-instruction-860,3,Education & Teaching Courses,https://www.classcentral.com/subject/education?page=1
Art & Inquiry: Museum Teaching Strategies For Your Classroom,https://www.classcentral.com/course/artinquiry-865,3,Education & Teaching Courses,https://www.classcentral.com/subject/education?page=1
Foundations of Teaching for Learning: Being a Professional,https://www.classcentral.com/course/professional-teacher-884,4,Education & Teaching Courses,https://www.classcentral.com/subject/education?page=1
Foundations of Teaching for Learning: Developing Relationships,https://www.classcentral.com/course/teacher-relationships-885,0,Education & Teaching Courses,https://www.classcentral.com/subject/education?page=1
Teach English Now! Technology Enriched Teaching,https://www.classcentral.com/course/tesol-technology-6211,5,Education & Teaching Courses,https://www.classcentral.com/subject/education?page=1
"Teach English Now! Second Language Reading, Writing, and Grammar ",https://www.classcentral.com/course/tesol-writing-6190,5,Education & Teaching Courses,https://www.classcentral.com/subject/education?page=1
World Class Maths: Asian Teaching Practice,https://www.classcentral.com/course/world-class-maths-practice-10577,0,Education & Teaching Courses,https://www.classcentral.com/subject/education?page=1
Teaching Impacts of Technology: Workplace of the Future,https://www.classcentral.com/course/teach-impacts-technology-workplace-futur-11235,0,Education & Teaching Courses,https://www.classcentral.com/subject/education?page=1
Teaching Impacts of Technology: Global Society,https://www.classcentral.com/course/teach-impacts-technology-global-society-11236,0,Education & Teaching Courses,https://www.classcentral.com/subject/education?page=1
Teaching English Online,https://www.classcentral.com/course/online-tutoring-11510,5,Education & Teaching Courses,https://www.classcentral.com/subject/education?page=1
Teaching Tips for Tricky English Grammar,https://www.classcentral.com/course/teaching-common-grammar-mistakes-7364,0,Education & Teaching Courses,https://www.classcentral.com/subject/education?page=1
Techniques for Teaching Adjectives and Adjective Clauses,https://www.classcentral.com/course/teaching-adjective-clauses-7366,0,Education & Teaching Courses,https://www.classcentral.com/subject/education?page=1
Social Pedagogy across Europe ,https://www.classcentral.com/course/social-pedagogy-europe-13225,0,Education & Teaching Courses,https://www.classcentral.com/subject/education?page=1
Учительський коучинг: сприяння розвитку сталих змін,https://www.classcentral.com/course/uchytelskyy-kouchynh-13554,0,Education & Teaching Courses,https://www.classcentral.com/subject/education?page=1
The Lancet Maternal Health Series: Global Research and Evidence,https://www.classcentral.com/course/maternal-health-8924,0,Health & Medicine Courses,https://www.classcentral.com/subject/health?page=23
Histology: Using Microscopy to Study Anatomy and Identify Disease,https://www.classcentral.com/course/histology-6870,4.5,Health & Medicine Courses,https://www.classcentral.com/subject/health?page=23
Opioid analgesics: Treating Pain in People with Cancer,https://www.classcentral.com/course/opioid-analgesics-13671,0,Health & Medicine Courses,https://www.classcentral.com/subject/health?page=23
Developing Clinical Empathy: Making a Difference in Patient Care,https://www.classcentral.com/course/clinical-empathy-11989,0,Health & Medicine Courses,https://www.classcentral.com/subject/health?page=23
Understanding Continence Promotion: Effective Management of Bladder and Bowel Dysfunction in Adults,https://www.classcentral.com/course/understanding-continence-promotion-11993,0,Health & Medicine Courses,https://www.classcentral.com/subject/health?page=23
"Global Health, Conflict and Violence",https://www.classcentral.com/course/medical-peace-work-global-health-12572,0,Health & Medicine Courses,https://www.classcentral.com/subject/health?page=23
The Monday Campaigns: Lessons in Public Health Promotion,https://www.classcentral.com/course/monday-campaigns-12666,0,Health & Medicine Courses,https://www.classcentral.com/subject/health?page=23
Aging Populations: Lessons In Healthy Aging From Japan,https://www.classcentral.com/course/aging-populations-14471,0,Health & Medicine Courses,https://www.classcentral.com/subject/health?page=23
Pharmacokinetics: Drug Dosing in Renal Disease,https://www.classcentral.com/course/pharmacokinetics-and-dosing-regimen-in-renal-dise-14409,0,Health & Medicine Courses,https://www.classcentral.com/subject/health?page=23
Nutrition and Wellbeing,https://www.classcentral.com/course/nutrition-wellbeing-3608,3.5,Health & Medicine Courses,https://www.classcentral.com/subject/health?page=23
Cancer in the 21st Century: the Genomic Revolution,https://www.classcentral.com/course/cancer-and-the-genomic-revolution-1244,4.8,Health & Medicine Courses,https://www.classcentral.com/subject/health?page=23
Understanding Depression and Low Mood in Young People,https://www.classcentral.com/course/depression-young-people-9270,0,Health & Medicine Courses,https://www.classcentral.com/subject/health?page=23
Addressing Postnatal Depression as a Healthcare Professional,https://www.classcentral.com/course/guided-self-help-for-postnatal-depression-13450,4,Health & Medicine Courses,https://www.classcentral.com/subject/health?page=23
Disease Outbreaks in Low and Middle Income Countries,https://www.classcentral.com/course/disease-outbreaks-15130,0,Health & Medicine Courses,https://www.classcentral.com/subject/health?page=23
Airway Matters,https://www.classcentral.com/course/airway-matters-17092,0,Health & Medicine Courses,https://www.classcentral.com/subject/health?page=23
Reversing Diabetes: Fact or Fiction?,https://www.classcentral.com/course/reversing-diabetes-fact-or-fiction-16923,0,Health & Medicine Courses,https://www.classcentral.com/subject/health?page=23
Quality Improvement in Healthcare: The Case for Change,https://www.classcentral.com/course/quality-improvement-6643,5,Health & Medicine Courses,https://www.classcentral.com/subject/health?page=23
Clinical Supervision: Planning Your Professional Development,https://www.classcentral.com/course/clinical-supervision-professional-development-9090,0,Health & Medicine Courses,https://www.classcentral.com/subject/health?page=23
An Introduction to Physical Health Assessment,https://www.classcentral.com/course/principles-of-physical-health-assessment-11905,0,Health & Medicine Courses,https://www.classcentral.com/subject/health?page=23
Could You Be the Next Florence Nightingale?,https://www.classcentral.com/course/nursing-and-public-health-11906,0,Health & Medicine Courses,https://www.classcentral.com/subject/health?page=23
Women’s Health After Motherhood,https://www.classcentral.com/course/womens-health-after-motherhood-16847,0,Health & Medicine Courses,https://www.classcentral.com/subject/health?page=23
Maternity Care: Building Relationships Really Does Save Lives,https://www.classcentral.com/course/maternity-care-9392,0,Health & Medicine Courses,https://www.classcentral.com/subject/health?page=23
Healthy Futures: How Can We Create the Most Effective Healthcare System?,https://www.classcentral.com/course/healthy-futures-10605,0,Health & Medicine Courses,https://www.classcentral.com/subject/health?page=23
Causes of Human Disease: Understanding Causes of Disease,https://www.classcentral.com/course/human-disease-understanding-causes-of-disease-9022,5,Health & Medicine Courses,https://www.classcentral.com/subject/health?page=23
Addressing Violence Through Patient Care,https://www.classcentral.com/course/addressing-violence-patient-care-12748,0,Health & Medicine Courses,https://www.classcentral.com/subject/health?page=23
Edward Jenner Leadership for Veterinary Professionals: Your Leadership Self,https://www.classcentral.com/course/discovering-self-as-leader-for-veterinary-profess-12479,0,Health & Medicine Courses,https://www.classcentral.com/subject/health?page=23
Critical Appraisal Techniques for Healthcare Literature,https://www.classcentral.com/course/critical-appraisal-techniques-healthcare-literatu-17906,0,Health & Medicine Courses,https://www.classcentral.com/subject/health?page=23
Regulatory requirements for medical devices including in vitro diagnostics in India (Version 2.0),https://www.classcentral.com/course/swayam-regulatory-requirements-for-medical-devices-including-in-vitro-diagnostics-in-india-version-2-0-17757,0,Health & Medicine Courses,https://www.classcentral.com/subject/health?page=23
Foundations in Dementia,https://www.classcentral.com/course/dementia-awareness-training-17222,0,Health & Medicine Courses,https://www.classcentral.com/subject/health?page=23
Young People and Their Mental Health,https://www.classcentral.com/course/young-people-mental-health-9491,4.4838709677419,Health & Medicine Courses,https://www.classcentral.com/subject/health?page=23
Non-Invasive Prenatal Testing (NIPT): An Introduction for Healthcare Professionals,https://www.classcentral.com/course/non-invasive-prenatal-testing-13251,0,Health & Medicine Courses,https://www.classcentral.com/subject/health?page=23
Antimicrobial Stewardship in Wound Management,https://www.classcentral.com/course/antimicrobial-stewardship-in-wound-management-13735,0,Health & Medicine Courses,https://www.classcentral.com/subject/health?page=23
Utilising Social Science and Behaviour Change in Antimicrobial Stewardship Programmes: Improving Healthcare,https://www.classcentral.com/course/behaviour-change-16908,0,Health & Medicine Courses,https://www.classcentral.com/subject/health?page=23
Inside Cancer: How Genes Influence Cancer Development,https://www.classcentral.com/course/inside-cancer-1254,4.25,Health & Medicine Courses,https://www.classcentral.com/subject/health?page=23
Digital Health for Cancer Management: Smart Health Technologies in Complex Diseases,https://www.classcentral.com/course/digital-cancer-management-9402,0,Health & Medicine Courses,https://www.classcentral.com/subject/health?page=23
Cancer Survivorship for Primary Care Practitioners,https://www.classcentral.com/course/cancer-survivorship-11485,0,Health & Medicine Courses,https://www.classcentral.com/subject/health?page=23
Causes of Human Disease: Transmitting and Fighting Infection,https://www.classcentral.com/course/human-disease-transmitting-and-fighting-infection-9023,5,Health & Medicine Courses,https://www.classcentral.com/subject/health?page=23
ECG Assessment: an Introduction for Healthcare Providers,https://www.classcentral.com/course/ecg-assessment-3945,3.8333333333333,Health & Medicine Courses,https://www.classcentral.com/subject/health?page=23
"Plagues, Pestilence and Pandemics: Are You Ready?",https://www.classcentral.com/course/plague-pestilence-pandemic-10553,0,Health & Medicine Courses,https://www.classcentral.com/subject/health?page=23
Using Infection Control to Combat Antimicrobial Resistance,https://www.classcentral.com/course/infection-control-antimicrobial-resistance-9088,0,Health & Medicine Courses,https://www.classcentral.com/subject/health?page=23
OPAT: Outpatient Parenteral Antimicrobial Therapy,https://www.classcentral.com/course/outpatient-parenteral-antimicrobial-therapy-11728,0,Health & Medicine Courses,https://www.classcentral.com/subject/health?page=23
Challenges in Antibiotic Resistance: Gram Negative Bacteria,https://www.classcentral.com/course/gram-negative-bacteria-8263,0,Health & Medicine Courses,https://www.classcentral.com/subject/health?page=23
Challenges in Antibiotic Resistance: Point Prevalence Surveys,https://www.classcentral.com/course/point-prevalence-surveys-8264,4,Health & Medicine Courses,https://www.classcentral.com/subject/health?page=23
Polycystic Ovary Syndrome: An Evidence-based Approach,https://www.classcentral.com/course/polycystic-ovary-syndrome-13677,5,Health & Medicine Courses,https://www.classcentral.com/subject/health?page=23
Assessment of the Newborn,https://www.classcentral.com/course/neonatal-assessment-11980,0,Health & Medicine Courses,https://www.classcentral.com/subject/health?page=23
End of Life Care: Challenges and Innovation,https://www.classcentral.com/course/end-of-life-care-16932,4.6923076923077,Health & Medicine Courses,https://www.classcentral.com/subject/health?page=23
Understanding Dementia,https://www.classcentral.com/course/independent-understanding-dementia-981,4.8851338151983,Health & Medicine Courses,https://www.classcentral.com/subject/health?page=23
Clinical Supervision with Confidence,https://www.classcentral.com/course/clinical-supervision-with-confidence-3161,4.5,Health & Medicine Courses,https://www.classcentral.com/subject/health?page=23
Causes of Human Disease: Exploring Cancer and Genetic Disease,https://www.classcentral.com/course/human-disease-exploring-cancer-genetic-disease-9024,5,Health & Medicine Courses,https://www.classcentral.com/subject/health?page=23
生存学の企て　病い、老い、障害とともに (ga124),https://www.classcentral.com/course/gacco-----ga124-13358,0,Health & Medicine Courses,https://www.classcentral.com/subject/health?page=21
Santé publique et système de santé : transitions et transformations,https://www.classcentral.com/course/france-universite-numerique-sante-publique-et-systeme-de-sante-transitions-et-transformations-12523,0,Health & Medicine Courses,https://www.classcentral.com/subject/health?page=21
Foundations of Evidence-Based Practice in Healthcare,https://www.classcentral.com/course/canvas-network-foundations-of-evidence-based-practice-in-healthcare-3855,5,Health & Medicine Courses,https://www.classcentral.com/subject/health?page=21
"Mindfulness: What It Is, Where It Comes From, and How to Practice It",https://www.classcentral.com/course/canvas-network-mindfulness-what-it-is-where-it-comes-from-and-how-to-practice-it-11958,4.5,Health & Medicine Courses,https://www.classcentral.com/subject/health?page=21
Creating Moments of Joy for People with Alzheimer’s,https://www.classcentral.com/course/creating-moments-of-joy-9409,4,Health & Medicine Courses,https://www.classcentral.com/subject/health?page=21
The Anthropological Demography of Health,https://www.classcentral.com/course/france-universite-numerique-the-anthropological-demography-of-health-12849,0,Health & Medicine Courses,https://www.classcentral.com/subject/health?page=21
Animal Physiology,https://www.classcentral.com/course/swayam-animal-physiology-12894,0,Health & Medicine Courses,https://www.classcentral.com/subject/health?page=21
Tabac : Arrêtez comme vous voulez !,https://www.classcentral.com/course/france-universite-numerique-tabac-arretez-comme-vous-voulez-12770,0,Health & Medicine Courses,https://www.classcentral.com/subject/health?page=21
Drying and Encapsulation of Food Ingredients in Powder Form,https://www.classcentral.com/course/futurelearn-drying-and-encapsulation-of-food-ingredients-in-powder-form-12704,0,Health & Medicine Courses,https://www.classcentral.com/subject/health?page=21
Managing Your Health Data,https://www.classcentral.com/course/managing-your-health-data-12473,0,Health & Medicine Courses,https://www.classcentral.com/subject/health?page=21
Parasitic Worms: Life Stories,https://www.classcentral.com/course/canvas-network-parasitic-worms-life-stories-5959,5,Health & Medicine Courses,https://www.classcentral.com/subject/health?page=21
Au cœur de la radioactivité médicale,https://www.classcentral.com/course/france-universite-numerique-au-coeur-de-la-radioactivite-medicale-10946,0,Health & Medicine Courses,https://www.classcentral.com/subject/health?page=21
At the heart of medical radioactivity,https://www.classcentral.com/course/france-universite-numerique-at-the-heart-of-medical-radioactivity-12851,0,Health & Medicine Courses,https://www.classcentral.com/subject/health?page=21
Current regulatory requirements for conducting clinical trials in India,https://www.classcentral.com/course/swayam-current-regulatory-requirements-for-conducting-clinical-trials-in-india-13041,0,Health & Medicine Courses,https://www.classcentral.com/subject/health?page=21
Regulatory requirements for medical devices and IVD (invitro diagnostic) kits in India,https://www.classcentral.com/course/swayam-regulatory-requirements-for-medical-devices-and-ivd-invitro-diagnostic-kits-in-india-13042,0,Health & Medicine Courses,https://www.classcentral.com/subject/health?page=21
"Sleep Deprivation: Habits, Solutions, and Strategies Teach-Out",https://www.classcentral.com/course/sleepdeprivation-9374,5,Health & Medicine Courses,https://www.classcentral.com/subject/health?page=21
Rural Healthcare Staffing Stability: Effective Tools and Practice,https://www.classcentral.com/course/independent-rural-healthcare-staffing-stability-effective-tools-and-practice-11064,0,Health & Medicine Courses,https://www.classcentral.com/subject/health?page=21
Medical Entomology,https://www.classcentral.com/course/france-universite-numerique-medical-entomology-10938,5,Health & Medicine Courses,https://www.classcentral.com/subject/health?page=21
Introduction to Critical Care Medicine,https://www.classcentral.com/course/critical-care-11058,0,Health & Medicine Courses,https://www.classcentral.com/subject/health?page=21
SMART-ASD: Matching Autistic People with Technology Resources,https://www.classcentral.com/course/supporting-autism-8076,0,Health & Medicine Courses,https://www.classcentral.com/subject/health?page=21
Palliative Care Always: India,https://www.classcentral.com/course/stanford-openedx-palliative-care-always-india-13551,0,Health & Medicine Courses,https://www.classcentral.com/subject/health?page=21
อาหารสำหรับผู้สูงอายุ (Food for Elders),https://www.classcentral.com/course/thaimooc-----food-for-elders-14985,0,Health & Medicine Courses,https://www.classcentral.com/subject/health?page=21
Introduction to Emergency Contraception,https://www.classcentral.com/course/emergency-contraception-10547,0,Health & Medicine Courses,https://www.classcentral.com/subject/health?page=21
Falling Down: Problematic Substance Use in Later Life,https://www.classcentral.com/course/substance-use-9261,0,Health & Medicine Courses,https://www.classcentral.com/subject/health?page=21
